text	object	context	role	section
Thus, tone mapping operation @@CITATION is introduced to map the real pixel values to the ones adapted to the displaying device.	tone  mapping  operation 	 to  map  the  real  pixel  values  to  the  ones  adapted  to  the  displaying  device	B-subj	method
1) Discussion : In @@CITATION an alternative closed form expression for MMSE-ZF equalizer is presented for the ZP case.	closed  form  expression  for  MMSE-ZF  equalizer 	for  the  ZP  case	B-subj	method
Besides these , several kernel learning methods ( @@CITATION ) have been proposed in semi-supervised setting by using side information .	 kernel  learning  methods 		B-subj	keywords
A closer description of the implemented interaction metaphors including a first pilot study is presented in @@CITATION, 2005b).	 implemented  interaction  metaphors 		B-subj	abstract
This idea, which was introduced in @@CITATION and illustrated by juxtaposing anatomical data from CoCoMac and electrophysiological recordings, became an influential concept.	This idea		B-subj	unknown
De Giacoma et al. @@CITATION proposed the HiDL-Lite language, which adds one layer on top of the DL-LiteR language.	HiDL-Lite  language		B-subj	conclusions
In 2011, Huber et al. @@CITATION proposed a model to predict the overheads for services running on a virtualization platform.	model  to  predict  the  overheads  for  services running  on  a  virtualization  platform		B-subj	method
We begin by recalling the notion of semantic distance proposed by Lehmann, Magidor and Schlechta @@CITATION in the context of belief revision.	semantic  distance 		B-subj	method
Recently an in situ dark field microscopy probe for online monitoring of cell density and viability in bioreactors has been proposed @@CITATION.	in  situ  dark  field  microscopy  probe 		B-subj	abstract
An early example is occupancy grid presented by Moravec and Elfes @@CITATION, which provides a probabilistic framework for representing the environment.	 occupancy  grid 	which  provides  a  probabilistic  framework  for  representing  the  environment	B-subj	abstract
In @@CITATION, we proposed the quaternion Fourier–Mellin moments (QFMMs), which can process the color image in a holistic manner.	quaternion  Fourier–Mellin  moments  (QFMMs)	which  can  process  the  color  image  in  a  holistic  manner	B-subj	acknowledgments
In a recent paper @@CITATION, Beasley introduced a new non-linear formulation of the constrained two-dimensional non-guillotine cutting problem.	non-linear  formulation  of  the  constrained  two-dimensional  non-guillotine  cutting  problem		B-subj	method
Besides, several approaches are proposed on the prediction of radio channel throughput [43, 44] and latency @@CITATION.	prediction  of  radio  channel 	latency 	B-subj	method
After, at the Operational Level, Labarthe et al. @@CITATION proposes the Operational Agent Model (OAM).	Operational  Agent  Model  (OAM)		B-subj	method
A complete decision procedure for provable data privacy [20] in the context of ALC is introduced in @@CITATION.	decision  procedure  for  provable  data  privacy 	 in  the  context  of  ALC 	B-subj	method
For example, Bertino, et al. @@CITATION presented a time-based scheme by using periodic authorizations and derivation rules.	time-based  scheme 		B-subj	related work
The following estimator for the missing mass, known as GoodTuring estimator was proposed in @@CITATION P0 = S1 n .	GoodTuring estimator 		B-subj	method
In @@CITATION we presented ValueCharts (VC), a set of interactive visualization techniques to support preferential choice.	ValueCharts  (VC)	a  set  of  interactive  visualization  techniques  to  support  preferential  choice	B-subj	introduction
Subsequently, Candes and Fernandez-Granda @@CITATION proposed an exciting new method for solving this inverse problem based on convex programming.	method for  solving  this  inverse  problem 		B-subj	introduction
In @@CITATION a two-stage hybrid model for filling the missing values using fuzzy c-means clustering and MLP is proposed.	two-stage  hybrid  model  for  filling  the  missing  values 		B-subj	introduction
Almeida Matos and Boudol @@CITATION also present a language where lexical scope enables more flows with a bisimulation-based security condition.	 languag		B-subj	unknown
A preliminary version of the co-notation was presented in @@CITATION, and a full introduction to the notation and its semantics is provided in [6].	co-notation  		B-subj	method
In Ref. @@CITATION, Kövesi et al. presented a stochastic K-means algorithm to improve the clustering result of K-means.	stochastic  K-means  algorithm 		B-subj	introduction
Although some multi-authority CP-ABE schemes @@CITATION have been proposed , they still can not deal with the problem of single-point bottleneck on both security and performance mentioned above .	 multi-authority  CP-ABE  schemes 		B-subj	abstract
A bandwidth pricing mechanism based on second-price auctions that solves congestion problems in communication networks has been proposed in @@CITATION.	bandwidth  pricing  mechanism 	that  solves  congestion  problems  in  communication  networks 	B-subj	method
Boehnen et al. @@CITATION present a standoff biometric system having an operation range of up to 7 m. The proposed system captures high quality 12 megapixel Near Infrared videos allowing for multi-sample and multi-modal comparisons.	standoff  biometric  system 		B-subj	keywords
In our previous work @@CITATION, we proposed Hidden Markov Model (HMM) separation for reverberant speech recognition, where the observed (reverberant) speech is separated into the acoustic transfer function and the clean speech HMM.	Hidden  Markov  Model  (HMM)  separation  for  reverberant  speech  recognition		B-subj	abstract
To surmount this problem, based on Higuchi’s fractal dimension (HFD) theory, time shift multiscale sample entropy was proposed by Tuan @@CITATION by redefining the coarse-grained procedure and was applied to process physiological signals.	time  shift  multiscale  sample  entropy 		B-subj	abstract
2.3 The Lasso and the Group Lasso The Least Absolute Shrinkage and Selection Operator (Lasso), introduced by Tibshirani (@@CITATION), is a penalized least squares method that imposes an L1-penalty on the regression coefficients.	Least  Absolute  Shrinkage  and  Selection  Operator  (Lasso)		B-subj	keywords
An insightful overview of the proportionate-type algorithms can be found in CIT ( chapter 5 ) ; also , some recently proposed proportionate-type NLMS algorithms can be found in @@CITATION .	proportionate-type  NLMS  algorithms 		B-subj	introduction
In the context of indoor positioning systems that use Wi-Fi technology, it is worth noting the pioneering work of Bahl et al. @@CITATION, who proposed the RADAR system.	RADAR  system		B-subj	keywords
Siblini @@CITATION proposed a mutation-based testing technique by applying mutation operators to WSDL documents in order to generate mutated interfaces that can be used for testing WSDL specification.	 mutation-based  testing  technique 		B-subj	keywords
Muelas et al. @@CITATION propose a VNS-based algorithm with seven different neighborhood classes (or shakers) for a DARP that arises in the area of San Francisco.	 VNS-based  algorithm 		B-subj	method
Various application areas for see-through displays have been proposed, ranging from their use in stores1 to their use as heads-up displays in cars @@CITATION and as home windows [?].	application  areas  for  see-through  displays 		B-subj	method
More recently, Thomas Vetter et al. @@CITATION proposed an algorithm to fit the 2D face images with 3D Morphable Models such that the face pose can be estimated.	algorithm  to  fit  the  2D  face  images  with  3D  Morphable  Models 		B-subj	keywords
A method for transforming an inverse problem into a correct direct problem, but for a higher-order equation, was proposed in @@CITATION and called Method of Variational Imbedding (MVI).	Method  of  Variational  Imbedding  (MVI)		B-subj	abstract
4.2 Corrupting System Call Return Address Fine-grained CFI as proposed by Abadi et al. @@CITATION validates the target address of every indirect branch.	Corrupting  System  Call  Return  Address  Fine-grained  CFI 		B-subj	method
1 Introduction Classic approaches to General Systems Theory ( GST ) , such as the one introduced in @@CITATION , only consider a single , “ horizontal ” dimension .	General  Systems  Theory  (  GST  )  		B-subj	introduction
In addition, Braganca and Machado @@CITATION and Wang et al. [24] propose automated approaches to transformation between feature models and use cases.	automated  approaches  to  transformation  between  feature  models  and  use  cases		B-subj	related work
In @@CITATION Bogopolski, Martino, Maslakova, and Ventura introduced an algorithm that relates the conjugacy problem in free-by-infinite cyclic groups to the twisted conjugacy problem in free groups.	algorithm 		B-subj	method
One consequence of our result is that the linear-time STOCHASTIC-GREEDY algorithm recently proposed in (@@CITATION) achieves the optimal running time while maintaining an optimal approximation guarantee.	STOCHASTIC-GREEDY  algorithm 		B-subj	abstract
On the AES block cipher, many such attacks have been proposed @@CITATION and the first non trivial and the most efficient attack has been described by Piret and Quisquater in [27].	attacks 		B-subj	keywords
1 Introduction Time-frequency atom decomposition ( TFAD ) , also known as matching pursuit or adaptive Gabor representation CIT , was introduced independently in @@CITATION .	Time-frequency  atom  decomposition  (  TFAD  ) 		B-subj	abstract
Other noise handling strategies, such as averaging by means of approximated models @@CITATION and modifications of the selection scheme [2, 15] have been proposed in the literature, but are not considered here.	averaging  by  means  of  approximated  models 		B-subj	method
Guermouche et al. @@CITATION proposed an uncoordinated checkpointing without domino effect with the help of logging useful application messages, which is applicable to SendDeterministic MPI applications.	uncoordinated  checkpointing  without  domino  effect 		B-subj	method
keywords: Belief Revision 1 Introduction One of the predominant approaches to model belief change was proposed by Alchourron, Gardenfors and Makinson and is known as the AGM framework @@CITATION.	approaches  to  model  belief  change 		B-subj	keywords
Filter bank multicarrier ( FBMC ) , a method that was initially proposed about 50 years ago , @@CITATION , is recently being considered as a candidate for 5G systems , CIT .	Filter  bank  multicarrier  (  FBMC  ) 		B-subj	abstract
Castro et al. @@CITATION proposed a reliable perception system based on sensor fusion between a millimeter-wave radar and a Laser Range Finder (LRF).	reliable  perception  system 	on  sensor  fusion  between  a  millimeter-wave  radar  and  a  Laser  Range  Finder  (LRF)	B-subj	unknown
A logical system that simultaneously describes properties of functional dependency between single variables and properties of the nondeducibility relation [8] has been proposed earlier @@CITATION.	 logical  system 		B-subj	abstract
Rosenthal @@CITATION first proposed a framework of congestion games, which is a special case of potential games [18] where the existence of a pure-strategy Nash equilibrium is guaranteed.	framework  of  congestion  games		B-subj	method
.@@CITATION proposed an even more multifaceted approach, using a multi-theoretical multi-level (MTML) model, for explaining the various motivations for the existence of social connections in a network.	multifaceted  approach		B-subj	method
Continuous-time recurrent neural networks (CTRNNs) are a class of neural networks introduced into the field of evolutionary robotics by @@CITATION but in use previously in the field of neuroscience.	Continuous-time  recurrent  neural  networks  (CTRNNs) 		B-subj	abstract
Kiritchenko et al. @@CITATION presented a supervised statistical text classification approach leveraging a variety of sentiment features derived from high-coverage tweet-specific sentiment lexicons.	supervised  statistical  text  classification  approach 		B-subj	related work
Smith et al. present a tracking algorithm using extended Kalman filtering of ultrasonic range data gathered from “Cricket” devices @@CITATION.	tracking  algorithm 		B-subj	introduction
Akbarinia et al. @@CITATION presented top-k query algorithms in Distributed Hash Tables (DHTs) based on their specific data storage mechanism.	top-k  query  algorithms  in  Distributed  Hash  Tables  (DHTs) 		B-subj	method
This “step-size control” approach was proposed in @@CITATION for the purpose of regulating OLA sizes on the route reply phase of an OLA-based reactive routing scheme.	“step-size  control”  approach 		B-subj	method
Data-centric processes : Multiple models for datacentric processes have been proposed in different lines of work such as Declarative Networking @@CITATION , Collaborative Workflows CIT , Webdamlog CIT , and others .	 Declarative  Networking 		B-subj	method
Cootes et al. proposed an Active Appearance Model (AAM) @@CITATION that represented a face image by subspace-projected parameters of facial shape and texture.	Active  Appearance  Model  (AAM) 		B-subj	method
Barsoum et al. @@CITATION proposed a multi-copy PDP scheme for static files, where the client generates t distinct copies of the file by encrypting the file under t different keys.	 multi-copy  PDP  scheme  for  static  files		B-subj	keywords
Although there is no known closed-form expression for V ’ s probability distribution function ( PDF ) , some accurate estimates of this distribution have been proposed in the literature , e.g. , @@CITATION .	accurate  estimates  of  this  distribution 		B-subj	unknown
The relational model was first introduced in the seminal work by Codd @@CITATION.	model 		B-subj	unknown
HYBRID DIFFERENTIAL EVOLUTION A. Differential evolution Differential evolution (DE) is a relatively new global optimisation method, introduced by Storn and Price in @@CITATION.	Differential  evolution 	global optimisation  method	B-subj	unknown
Delaluz et al. @@CITATION proposed a compiler-directed approach to cluster the data across memory banks, detect memory module idleness and insert power-state transition instructions into a program by offline profiling.	compiler-directed  approach 	 to  cluster  the  data  across  memory  banks,  detect  memory  module  idleness  and  insert  power-state  transition  instructions  into  a  program  by  offline  profiling	B-subj	unknown
Some trust-based approaches such as @@CITATION, Paolo Massa and Paolo Avesani proposed a trust-aware recommender system.	trust-based  approaches 	trust-based  approaches 	B-subj	unknown
This issue has been addressed by AbellÃ³ et al. @@CITATION by introducing a number of relationships that can be used to navigate between different data marts of the same data warehouse.	relationships 	that  can  be  used  to  navigate  between  different  data  marts  of  the  same  data  warehouse	B-subj	unknown
6 The integration tool The various techniques described in the previous sections have been implemented in an interactive tool called DaWaII (Data Warehouse IntegratIon) that has been presented as a demo in @@CITATION.	interactive  tool  called  DaWaII 		B-subj	unknown
An optimal fusion rule was proposed in @@CITATION.	fusion  rule 		B-subj	unknown
An estimation technique of these two parameters was presented in @@CITATION, but it needs long training sequences and responds slowly to time varying environment.	estimation  technique 	it  needs  long  training  sequences  and  responds  slowly  to  time  varying  environment	B-subj	unknown
Other implementation techniques have been proposed for dealing with uncertainty in logic programming, for instance translation into Disjunctive Stable Models @@CITATION, but rely on the properties of specific truth-value domains.	implementation  techniques 	for  dealing  with  uncertainty  in  logic  programming	B-subj	unknown
Anisotropic diffusion was proposed in the context of scale space @@CITATION.	Anisotropic  diffusion 	in  the  context  of  scale  space 	B-subj	unknown
Kojima et al @@CITATION propose an approach to generate a natural language descriptions of human behavior from real video images.	approach 	to  generate  a  natural  language  descriptions  of  human  behavior  from  real  video  images	B-subj	unknown
Seitz and Dyer @@CITATION proposed an affine view-invariant trajectory matching method to analyze cyclic motion.	view-invariant  trajectory  matching  method 	to  analyze  cyclic  motion	B-subj	unknown
Davis et al @@CITATION proposed a motion recognition method by fitting sinusoidal model.	motion  recognition  method 	 by  fitting  sinusoidal  model	B-subj	unknown
Yacoob and Black @@CITATION proposed a method for modeling and recognizing activities.	method 	for  modeling  and  recognizing  activities	B-subj	unknown
Wei @@CITATION proposed an algorithm for filling holes that starts with a hole identification phase and then applies a triangulation of the hole region using the Advancing Front Method.	algorithm 	for  filling  holes  that  starts  with  a  hole  identification  phase  and  then  applies  a  triangulation  of  the  hole  region  using  the  Advancing  Front  Method	B-subj	unknown
2.3 Handling of Unknown Words Currently, the method of handling unknown words that seems to work best for inflected languages is a suffix analysis as proposed in (@@CITATION).	suffix  analysis 	is  a  suffix  analysis 	B-subj	unknown
The breakthrough in integer transforms designing was lifting introduced by I. Daubechies and W. Sweldens @@CITATION.	integer  transforms  designing 		B-subj	unknown
Factorization of complex multiplications is based on the method presented in @@CITATION.	method 	of  complex  multiplications 	B-subj	unknown
This choice has been inspired by the 3-Hand Manipulation technique which has been introduced in @@CITATION.	3-Hand  Manipulation 		B-subj	unknown
The Reconfigurable Tangible Device The Reconfigurable Tangible Device (RTD) has been introduced in @@CITATION.	Reconfigurable  Tangible  Device  (RTD) 		B-subj	unknown
Subjective Ratings We recall here the subjective results that have already been presented in @@CITATION.	results 		B-subj	unknown
Two-Handed Object Manipulation Several 3D interaction techniques have been proposed to manipulate virtual objects with the two hands of a single user @@CITATION.	3D  interaction 	to  manipulate  virtual  objects  with  the  two  hands  of  a  single  user 	B-subj	unknown
Several low resolution ADCs are presented in @@CITATION, [17], [18] and one such solution could be implemented with the digital control loop for a single chip solution.	low  resolution  ADC	digital  control  loop  for  a  single  chip  solution	B-subj	unknown
This syntactic approximation of locality was proposed in @@CITATION and provides a basis for most of the modern modularity algorithms [3].	syntactic  approximation  of  locality 	provides  a  basis  for  most  of  the  modern  modularity  algorithms 	B-subj	unknown
Precision compared to the Fletch full type safety system The â€œfull type safetyâ€ system proposed by Ernst et al. @@CITATION is another approach to sound type checking for Dart.	â€œfull  type  safetyâ€system 	to  sound  type  checking  for  Dart	B-subj	unknown
These observations are added into the BA introduced in @@CITATION to constrain the 3D points of the object.	BA 	 to  constrain  the  3D  points  of  the  object	B-subj	unknown
A model with counters which can be incremented and reset in the same way as in R-automata, called B-automata, is presented in @@CITATION.	B-automata	model  with  counters  which  can  be  incremented  and  reset  in  the  same  way  as  in  R-automata	B-subj	unknown
Some early approaches include the implication models introduced in @@CITATION and [13].	implication  models 		B-subj	unknown
CFE-BASED UNCERTAIN IMPLICATIONS A new method for reasoning with uncertain evidence is introduced in @@CITATION.	method 	for  reasoning  with  uncertain  evidence 	B-subj	unknown
To model this behavior, various approaches were proposed such as centersurround operation [16] or graph based activation maps @@CITATION.	graph  based  activation  maps 		B-subj	unknown
The practical DSL scheme proposed in @@CITATION only requires the primary system to broadcast the values of I0 and Q0.	DSL  scheme 	requires  the  primary  system  to  broadcast  the  values  of  I0  and  Q0	B-subj	unknown
A cooperative scheme in which secondary users actively collaborate with the primary user transmissions was proposed in @@CITATION.	cooperative  scheme 	in  which  secondary  users  actively  collaborate  with  the  primary  user  transmissions 	B-subj	unknown
Other solutions @@CITATIONâ€“[6] propose hierarchical SDN controllers which offload computation that does not require network-wide view to local controllers running on (or close to) the switches.	hierarchical  SDN  controllers 	which  offload  computation  that  does  not  require  network-wide  view  to  local  controllers  running  on  (or  close  to)  the  switches	B-subj	unknown
To diminish the effect of brightness reduction from the image center to the borders due to the sensor optics, all images were empirically corrected using the vignette correction algorithm proposed by Zheng et al. @@CITATION.	vignette  correction  algorithm 	To  diminish  the  effect  of  brightness  reduction  from  the  image  center  to  the  borders  due  to  the  sensor  optics	B-subj	unknown
Turk and Banks introduced an image-based technique to create images with an even density of streamlines by lowpass filtering the image generated and optimizing streamline placement to reduce variation in the image @@CITATION.	image-based  technique 	to  create  images  with  an  even  density  of  streamlines  by  lowpass  filtering  the  image  generated  and  optimizing  streamline  placement  to  reduce  variation  in  the  image 	B-subj	unknown
Ray et al. [11] and Kalberer et al. @@CITATION proposed two globally smooth parameterization methods for arbitrary surfaces, which can be naturally applied in tracing the curve network.	parameterization  methods 	which  can  be  naturally  applied  in  tracing  the  curve  network	B-subj	unknown
Dialogue agents as introduced in @@CITATION decide about the next action based on the dialogue state distribution given by the tracker.	Dialogue  agents 	decide  about  the  next  action  based  on  the  dialogue  state  distribution  given  by  the  tracker	B-subj	unknown
Such an approach was proposed in @@CITATION.	approach 		B-subj	unknown
In the original approach presented in @@CITATION, each auxiliary objective is selected just once and is optimized for the same number of iterations.	approach 		B-subj	unknown
This notion has been introduced in Schmalfuss @@CITATION.	notion 		B-subj	unknown
Rankjoin was first proposed by Ilyas et al. @@CITATION to produce top-k join tuples in a relational database.	Rankjoin 	to  produce  top-k  join  tuples  in  a  relational  database.	B-subj	unknown
"5 A list of n-best suggestions is standard approach for presenting candidate corrections for misspellings (@@CITATION; Mitton, 2008)."	approach 	approach for  presenting  candidate  corrections  for  misspellings  	B-subj	unknown
Multiplication of ranks has been proposed as an aggregation procedure by @@CITATION, 2008).	aggregation  procedure 	 an  aggregation  procedure 	B-subj	unknown
"Two more optimization variants were introduced in @@CITATION; we describe their decision versions below."	optimization 		B-subj	unknown
Graph Motif was introduced by Lacroix et al. @@CITATION and motivated by applications in bioinformatics, specifically in metabolic network analysis.	Graph  Motif 	by  applications  in  bioinformatics	B-subj	unknown
2.2 Preliminaries on branching walks The concept of branching walks was first introduced by Nederlof @@CITATION to sieve for Steiner trees.	branching  walks 	to  sieve  for  Steiner  trees	B-subj	unknown
As part of their NORPLAN framework, Farid and Mitropoulos propose requirements quality metrics for non-functional requirements @@CITATION.	requirements  quality  metrics 	for  non-functional  requirements 	B-subj	unknown
Gomez, Rueda and Alarcon propose a conceptual method for identifying dependencies between User Stories, relying on the data entities that stories refer to @@CITATION.	data  entities 	conceptual  method  for  identifying  dependencies  between  User  Stories	B-subj	unknown
Patel and Ramachandran propose the Story Card Maturity Model, a CMM-based process improvement model for story cards and their key process areas @@CITATION.	CMM-based  process  improvement  model 	a  CMM-based  process for  story  cards  and  their  key  process  areas 	B-subj	unknown
3.1.5 Problem-oriented In line with the problem specification principle proposed by Zave and Jackson @@CITATION, a user story should only specify the problem.	problem  specification  principle 	user  story  should  only  specify  the  problem	B-subj	unknown
The Ising channel, on the other hand, was introduced as an information theory problem by Berger and Bonomi in 1990 @@CITATION.	 Ising  channel	information  theory  problem  by  Berger  and  Bonomi 	B-subj	unknown
One can also use the mapping presented in @@CITATION.	mapping 		B-subj	unknown
This transformation allows us to apply the same reasoning process introduced in @@CITATION even in the presence of conditional goals, decompositions and contributions.	reasoning  process 	even  in  the  presence  of  conditional  goals,  decompositions  and  contributions	B-subj	unknown
