text	object	context	role	section
To address this problem, there are works proposing a system based on the use of SC tools that allow projects to evolve dynamically with the possible changes in the scenarios over time @@CITATION.	system 	allow  projects  to  evolve  dynamically  with  the  possible  changes  in  the  scenarios  over  time  	B-subj	unknown
For instance, outdoors, the City of London introduced a system for data collection in its transportation system including buses, subways and trains @@CITATION.	system 	transportation  system  including  buses,  subways  and  trains 	B-subj	unknown
Cintra and Llanos @@CITATION proposed a run-time system that performs eager memory management where each speculative operation checks if misspeculation occurred and updates the non-speculative memory directly when there is no misspeculation.	run-time  system 	performs  eager  memory  management  where  each  speculative  operation  checks  if  misspeculation  occurred  and  updates  the  non-speculative  memory  directly 	B-subj	unknown
Mehrara et al. @@CITATION enable dynamic speculative parallelization of Javascript programs by proposing ultra-lightweight software speculation mechanism.	ultra-lightweight  software  speculation  mechanism	dynamic  speculative  parallelization  of  Javascript  programs 	B-subj	unknown
Talbot et al. present Riposte @@CITATION, a runtime system that is able to dynamically discover and extract sequences of vector operations from arbitrary R code.	Riposte 	a  runtime  system  that  is  able  to  dynamically  discover  and  extract  sequences  of  vector  operations  from  arbitrary  R  code	B-subj	unknown
To support speculation in conjunction with pipelined parallelization, a run-time system called MultiThreaded Transactions (MTXs) @@CITATION has been proposed.	MultiThreaded  Transactions  (MTXs) 	To  support  speculation  in  conjunction  with  pipelined  parallelization	B-subj	unknown
DPE, as a GNSS positioning alternative, was proposed in @@CITATION.	DPE	as  a  GNSS  positioning  alternative	B-subj	unknown
Agarwal et al. @@CITATION proposed a Monte Carlo algorithm for this task.	Monte  Carlo  algorithm 	for  this  task	B-subj	unknown
2.1 Probabilistic Relevance Feedback (PRF) This is the term relevance weighting formula proposed by Robertson and Sparck Jones in @@CITATION.	term  relevance  weighting  formula 		B-subj	unknown
Clements and Felleisen @@CITATION present a properly tail-call optimized semantics for stack inspection based 168 M.S.	tail-call  optimized  semantics 	for  stack  inspection 	B-subj	unknown
Wallach et al. @@CITATION present a semantics for stack inspection based on a belief logic.	semantics  for  stack  inspection 	based  on  a  belief  logic	B-subj	unknown
An analytical method for computing a precise initial estimate for both the LIDARâ€™s intrinsic parameters and the 3D LIDARcamera transformation is presented in @@CITATION.	method 	for  computing  a  precise  initial  estimate  for  both  the  LIDARâ€™s  intrinsic  parameters  and  the  3D  LIDARcamera  transformation 	B-subj	unknown
Further, the authors in @@CITATION present a mutual information based algorithm for automatic extrinsic calibration of a 3D LIDAR-camera system without the need for any specific calibration target.	mutual  information  based  algorithm 	for  automatic  extrinsic  calibration  of  a  3D  LIDAR-camera  system  without  the  need  for  any  specific  calibration  target	B-subj	unknown
One of the earliest methods presented in @@CITATION is based on the constraints between different views of a planar calibration pattern from the camera and the LRF.	methods 	is  based  on  the  constraints  between  different  views  of  a  planar  calibration  pattern  from  the  camera  and  the  LRF	B-subj	unknown
Naroditsky et al. presented a solution using this technique in @@CITATION.	solution 		B-subj	unknown
The work described in @@CITATION, presents an approach only requiring the observation of a scene corner (orthogonal trihedron) commonly found in any human-made environment.	approach 	only  requiring  the  observation  of  a  scene  corner  (orthogonal  trihedron) 	B-subj	unknown
In 1982, Siegel proposed the RM estimator with a high breakdown point of 50% (@@CITATION).	RM  estimator 	with  a  high  breakdown  point  of  50% 	B-subj	unknown
MOTIVATION Several distributed SDN controller architectures have been proposed @@CITATION to reduce the likelihood of controller overload and minimize the impact of controller failures.	SDN  controller  architectures 	to  reduce  the  likelihood  of  controller  overload  and  minimize  the  impact  of  controller  failures	B-subj	unknown
The authors leveraged the PCK-Means algorithm proposed by Basu, Banerjee and Mooney @@CITATION for clustering, and the pairwise constraints were incorporated into the k-means algorithm as a penalty in the cluster assignment state.	PCK-Means  algorithm 	for  clustering,  and  the  pairwise  constraints  were  incorporated  into  the  k-means  algorithm  as  a  penalty  in  the  cluster  assignment  state	B-subj	unknown
Our approach was primarily inspired by the method proposed by Xing et al. @@CITATION.	method 		B-subj	unknown